{
  "description": "Automatically annotates SOAP requests with extracted usernames and body elements in the Notes column",
  "edition": 2,
  "graph": {
    "edges": [
      {
        "source": {
          "exec_alias": "exec",
          "node_id": 0
        },
        "target": {
          "exec_alias": "exec",
          "node_id": 2
        }
      },
      {
        "source": {
          "exec_alias": "true",
          "node_id": 2
        },
        "target": {
          "exec_alias": "exec",
          "node_id": 3
        }
      },
      {
        "source": {
          "exec_alias": "exec",
          "node_id": 3
        },
        "target": {
          "exec_alias": "exec",
          "node_id": 1
        }
      },
      {
        "source": {
          "exec_alias": "false",
          "node_id": 2
        },
        "target": {
          "exec_alias": "exec",
          "node_id": 1
        }
      }
    ],
    "nodes": [
      {
        "alias": "start",
        "definition_id": "caido/passive-start",
        "display": {
          "x": 0,
          "y": -120
        },
        "id": 0,
        "inputs": [],
        "name": "Start",
        "version": "^0.1.0"
      },
      {
        "alias": "end",
        "definition_id": "caido/passive-end",
        "display": {
          "x": 0,
          "y": 200
        },
        "id": 1,
        "inputs": [],
        "name": "End",
        "version": "^0.1.0"
      },
      {
        "alias": "soap_check",
        "definition_id": "caido/httpql-matches",
        "display": {
          "x": 0,
          "y": 20
        },
        "id": 2,
        "inputs": [
          {
            "alias": "query",
            "value": {
              "data": "req.headers[\"content-type\"] ~= \"soap\\+xml\" AND req.in_scope == true",
              "kind": "string"
            }
          },
          {
            "alias": "request",
            "value": {
              "data": "$start.data.request",
              "kind": "ref"
            }
          }
        ],
        "name": "SOAP Check",
        "version": "^0.1.0"
      },
      {
        "alias": "annotate_soap",
        "definition_id": "caido/javascript",
        "display": {
          "x": 0,
          "y": 100
        },
        "id": 3,
        "inputs": [
          {
            "alias": "data",
            "value": {
              "data": "$start.data",
              "kind": "ref"
            }
          }
        ],
        "name": "Annotate SOAP",
        "version": "^0.1.0"
      }
    ]
  },
  "id": "annotate-soap-requests",
  "kind": "passive",
  "name": "Annotate SOAP Requests"
}