{
  "description": "Randomizes a single number selection between 0 through 9",
  "edition": 2,
  "graph": {
    "edges": [
      {
        "source": {
          "exec_alias": "exec",
          "node_id": 0
        },
        "target": {
          "exec_alias": "exec",
          "node_id": 2
        }
      },
      {
        "source": {
          "exec_alias": "exec",
          "node_id": 2
        },
        "target": {
          "exec_alias": "exec",
          "node_id": 1
        }
      }
    ],
    "nodes": [
      {
        "alias": "convert_start",
        "definition_id": "caido/convert-start",
        "display": {
          "x": 160,
          "y": -130
        },
        "id": 0,
        "inputs": [],
        "name": "Convert Start",
        "version": "0.1.0"
      },
      {
        "alias": "convert_end",
        "definition_id": "caido/convert-end",
        "display": {
          "x": 160,
          "y": 90
        },
        "id": 1,
        "inputs": [
          {
            "alias": "data",
            "value": {
              "data": "$javascript.data",
              "kind": "ref"
            }
          }
        ],
        "name": "Convert End",
        "version": "0.1.0"
      },
      {
        "alias": "javascript",
        "definition_id": "caido/code-js",
        "display": {
          "x": 160,
          "y": -30
        },
        "id": 2,
        "inputs": [
          {
            "alias": "data",
            "value": {
              "data": "$convert_start.data",
              "kind": "ref"
            }
          },
          {
            "alias": "code",
            "value": {
              "data": "function randomizeNumber() {\n  // Force fresh random each time with timestamp entropy\n  return Math.floor((Math.random() + Date.now() / 1000000000) * 10) % 10;\n}\n\nfunction u(n, r) {\n  const t = r.asString(n);\n  let result = \"\";\n  \n  for (const char of t) {\n    if (/[0-9]/.test(char)) {\n      result += randomizeNumber(); // Fresh call each time\n    } else {\n      result += char;\n    }\n  }\n  \n  return result;\n}\n\nexport {\n  u as run\n};",
              "kind": "string"
            }
          }
        ],
        "name": "Javascript",
        "version": "0.1.0"
      }
    ]
  },
  "id": "c1435aa7-8fca-4563-afa3-fd1577164641",
  "kind": "convert",
  "name": "Randomizer 0-9"
}