{
  "description": "Exports raw content to a file with original format",
  "edition": 2,
  "graph": {
    "edges": [
      {
        "source": {
          "exec_alias": "exec",
          "node_id": 0
        },
        "target": {
          "exec_alias": "exec",
          "node_id": 2
        }
      },
      {
        "source": {
          "exec_alias": "exec",
          "node_id": 2
        },
        "target": {
          "exec_alias": "exec",
          "node_id": 1
        }
      }
    ],
    "nodes": [
      {
        "alias": "convert_start",
        "definition_id": "caido/convert-start",
        "display": {
          "x": -10,
          "y": -100
        },
        "id": 0,
        "inputs": [],
        "name": "Convert Start",
        "version": "0.1.0"
      },
      {
        "alias": "convert_end",
        "definition_id": "caido/convert-end",
        "display": {
          "x": -20,
          "y": 190
        },
        "id": 1,
        "inputs": [
          {
            "alias": "data",
            "value": {
              "data": "$shell.data",
              "kind": "ref"
            }
          }
        ],
        "name": "Convert End",
        "version": "0.1.0"
      },
      {
        "alias": "shell",
        "definition_id": "caido/shell-cmd",
        "display": {
          "x": -20,
          "y": 10
        },
        "id": 2,
        "inputs": [
          {
            "alias": "shell",
            "value": {
              "data": "bash",
              "kind": "string"
            }
          },
          {
            "alias": "code",
            "value": {
              "data": "# Create exports directory\nexport_dir=\"$HOME/caido_exports\"\nmkdir -p \"$export_dir\"\n\n# Create temp file first to analyze content\ntmp_file=$(mktemp)\ntrap 'rm -f \"$tmp_file\"' EXIT\n\n# Save input to temp file first\ncat - > \"$tmp_file\"\n\n# Get file info\nfile_info=$(/usr/bin/file -b \"$tmp_file\")\n\n# Generate readable timestamp (Dec-20-2024_15-30-45)\ntimestamp=$(date \"+%b-%d-%Y_%H-%M-%S\")\n\n# Set output filename - always .bin for unrecognized types\noutput_file=\"$export_dir/raw_${timestamp}.bin\"\n\n# Copy from temp file to final location\ncp \"$tmp_file\" \"$output_file\"\n\n# Get file size\nfile_size=$(stat -f%z \"$output_file\" 2>/dev/null || stat -c%s \"$output_file\")\n\n# Output results\necho \"File exported successfully:\"\necho \"Location: $output_file\"\necho \"Size: $file_size bytes\"\necho \"Type: $file_info\"\n",
              "kind": "string"
            }
          },
          {
            "alias": "timeout",
            "value": {
              "data": 5000,
              "kind": "integer"
            }
          },
          {
            "alias": "data",
            "value": {
              "data": "$convert_start.data",
              "kind": "ref"
            }
          }
        ],
        "name": "Shell",
        "version": "0.1.0"
      }
    ]
  },
  "kind": "convert",
  "name": "Export Raw Content",
  "id": "export-raw-content"
}
