{
    "description": "Workflow to convert JSON to form data",
    "edition": 2,
    "graph": {
      "edges": [
        {
          "source": {
            "exec_alias": "exec",
            "node_id": 0
          },
          "target": {
            "exec_alias": "exec",
            "node_id": 2
          }
        },
        {
          "source": {
            "exec_alias": "exec",
            "node_id": 2
          },
          "target": {
            "exec_alias": "exec",
            "node_id": 1
          }
        }
      ],
      "nodes": [
        {
          "alias": "convert_start",
          "definition_id": "caido/convert-start",
          "display": {
            "x": 0,
            "y": 0
          },
          "id": 0,
          "inputs": [],
          "name": "Convert Start",
          "version": "0.1.0"
        },
        {
          "alias": "convert_end",
          "definition_id": "caido/convert-end",
          "display": {
            "x": -20,
            "y": 200
          },
          "id": 1,
          "inputs": [
            {
              "alias": "data",
              "value": {
                "data": "$javascript.data",
                "kind": "ref"
              }
            }
          ],
          "name": "Convert End",
          "version": "0.1.0"
        },
        {
          "alias": "javascript",
          "definition_id": "caido/code-js",
          "display": {
            "x": -10,
            "y": 100
          },
          "id": 2,
          "inputs": [
            {
              "alias": "data",
              "value": {
                "data": "$convert_start.data",
                "kind": "ref"
              }
            },
            {
              "alias": "code",
              "value": {
                "data": "",
                "kind": "string"
              }
            }
          ],
          "name": "Javascript",
          "version": "0.1.0"
        }
      ]
    },
    "id": "1acf5d9f-9605-447b-a378-139e5861ba52",
    "kind": "convert",
    "name": "JSON To Form Data"
  }