{
    "description": "Base64 decode a string",
    "edition": 2,
    "graph": {
      "edges": [
        {
          "source": {
            "exec_alias": "exec",
            "node_id": 0
          },
          "target": {
            "exec_alias": "exec",
            "node_id": 2
          }
        },
        {
          "source": {
            "exec_alias": "exec",
            "node_id": 2
          },
          "target": {
            "exec_alias": "exec",
            "node_id": 1
          }
        }
      ],
      "nodes": [
        {
          "alias": "start",
          "definition_id": "caido/convert-start",
          "display": {
            "x": 0,
            "y": -150
          },
          "id": 0,
          "inputs": [],
          "name": "Start",
          "version": "^0.1.0"
        },
        {
          "alias": "end",
          "definition_id": "caido/convert-end",
          "display": {
            "x": 0,
            "y": 230
          },
          "id": 1,
          "inputs": [
            {
              "alias": "data",
              "value": {
                "data": "$base64_decode.data",
                "kind": "ref"
              }
            }
          ],
          "name": "End",
          "version": "^0.1.0"
        },
        {
          "alias": "base64_decode",
          "definition_id": "caido/base64-decode",
          "display": {
            "x": 0,
            "y": 30
          },
          "id": 2,
          "inputs": [
            {
              "alias": "format",
              "value": {
                "data": "STANDARD",
                "kind": "string"
              }
            },
            {
              "alias": "data",
              "value": {
                "data": "$start.data",
                "kind": "ref"
              }
            }
          ],
          "name": "Base64 Decode",
          "version": "^0.2.0"
        }
      ]
    },
    "id": "b3fa70bb-df5c-4b39-b261-50b1c3fc4bb5",
    "kind": "convert",
    "name": "Base64 Decode"
  }