{
  "description": "Identifies JSONP endpoints that could bypass CSP restrictions through controllable callback parameters",
  "edition": 2,
  "graph": {
    "edges": [
      {
        "source": {
          "exec_alias": "exec",
          "node_id": 0
        },
        "target": {
          "exec_alias": "exec",
          "node_id": 2
        }
      },
      {
        "source": {
          "exec_alias": "exec",
          "node_id": 2
        },
        "target": {
          "exec_alias": "exec",
          "node_id": 3
        }
      },
      {
        "source": {
          "exec_alias": "exec",
          "node_id": 3
        },
        "target": {
          "exec_alias": "exec",
          "node_id": 1
        }
      }
    ],
    "nodes": [
      {
        "alias": "start",
        "definition_id": "caido/passive-start",
        "display": {
          "x": 0,
          "y": -120
        },
        "id": 0,
        "inputs": [],
        "name": "Start",
        "version": "^0.1.0"
      },
      {
        "alias": "end",
        "definition_id": "caido/passive-end",
        "display": {
          "x": 0,
          "y": 230
        },
        "id": 1,
        "inputs": [],
        "name": "End",
        "version": "^0.1.0"
      },
      {
        "alias": "jsonp_check",
        "definition_id": "caido/javascript",
        "display": {
          "x": 0,
          "y": 60
        },
        "id": 2,
        "inputs": [
          {
            "alias": "data",
            "value": {
              "data": "$start.data",
              "kind": "ref"
            }
          }
        ],
        "name": "JSONP Check",
        "version": "^0.1.0"
      },
      {
        "alias": "color_yellow",
        "definition_id": "caido/color-set",
        "display": {
          "x": 0,
          "y": 140
        },
        "id": 3,
        "inputs": [
          {
            "alias": "color",
            "value": {
              "data": "yellow",
              "kind": "string"
            }
          },
          {
            "alias": "request",
            "value": {
              "data": "$start.data.request",
              "kind": "ref"
            }
          }
        ],
        "name": "Color Yellow",
        "version": "^0.1.0"
      }
    ]
  },
  "id": "jsonp-csp-bypass",
  "kind": "passive",
  "name": "JSONP CSP Bypass"
}