{
  "description": "Detects and highlights specific server names in HTTP response Server headers",
  "edition": 2,
  "graph": {
    "edges": [
      {
        "source": {
          "exec_alias": "exec",
          "node_id": 0
        },
        "target": {
          "exec_alias": "exec",
          "node_id": 2
        }
      },
      {
        "source": {
          "exec_alias": "true",
          "node_id": 2
        },
        "target": {
          "exec_alias": "exec",
          "node_id": 3
        }
      },
      {
        "source": {
          "exec_alias": "exec",
          "node_id": 3
        },
        "target": {
          "exec_alias": "exec",
          "node_id": 4
        }
      },
      {
        "source": {
          "exec_alias": "exec",
          "node_id": 4
        },
        "target": {
          "exec_alias": "exec",
          "node_id": 1
        }
      },
      {
        "source": {
          "exec_alias": "false",
          "node_id": 2
        },
        "target": {
          "exec_alias": "exec",
          "node_id": 1
        }
      }
    ],
    "nodes": [
      {
        "alias": "start",
        "definition_id": "caido/passive-start",
        "display": {
          "x": 0,
          "y": -120
        },
        "id": 0,
        "inputs": [],
        "name": "Start",
        "version": "^0.1.0"
      },
      {
        "alias": "end",
        "definition_id": "caido/passive-end",
        "display": {
          "x": 0,
          "y": 280
        },
        "id": 1,
        "inputs": [],
        "name": "End",
        "version": "^0.1.0"
      },
      {
        "alias": "server_check",
        "definition_id": "caido/httpql-matches",
        "display": {
          "x": 0,
          "y": 20
        },
        "id": 2,
        "inputs": [
          {
            "alias": "query",
            "value": {
              "data": "resp.headers[\"server\"] EXISTS",
              "kind": "string"
            }
          },
          {
            "alias": "request",
            "value": {
              "data": "$start.data.request",
              "kind": "ref"
            }
          }
        ],
        "name": "Server Header Check",
        "version": "^0.1.0"
      },
      {
        "alias": "highlight_red",
        "definition_id": "caido/color-set",
        "display": {
          "x": 0,
          "y": 120
        },
        "id": 3,
        "inputs": [
          {
            "alias": "color",
            "value": {
              "data": "red",
              "kind": "string"
            }
          },
          {
            "alias": "request",
            "value": {
              "data": "$start.data.request",
              "kind": "ref"
            }
          }
        ],
        "name": "Highlight Red",
        "version": "^0.1.0"
      },
      {
        "alias": "add_notes",
        "definition_id": "caido/javascript",
        "display": {
          "x": 0,
          "y": 200
        },
        "id": 4,
        "inputs": [
          {
            "alias": "data",
            "value": {
              "data": "$start.data",
              "kind": "ref"
            }
          }
        ],
        "name": "Add Server Notes",
        "version": "^0.1.0"
      }
    ]
  },
  "id": "detect-server-names",
  "kind": "passive",
  "name": "Detect Server Names"
}